{
  "schemaVersion": "1.0",
  "importId": "8e5221a4-23c7-4d77-907b-48b4c87c744f",
  "importType": "recipes",
  "source": "FREEZER OS editable recipe templates",
  "generatedAt": "2026-10-14T00:00:00Z",
  "payload": [
    {
      "name": "Hovädzí Bún bò Nam Bộ bowl",
      "portions": 2,
      "ingredients": [
        {
          "name": "Hovädzie rezančeky",
          "quantity": 420,
          "unit": "g"
        },
        {
          "name": "Jazmínová ryža",
          "quantity": 150,
          "unit": "g"
        },
        {
          "name": "Mrkva",
          "quantity": 100,
          "unit": "g"
        },
        {
          "name": "Červená paprika",
          "quantity": 150,
          "unit": "g"
        },
        {
          "name": "Cibuľa",
          "quantity": 60,
          "unit": "g"
        },
        {
          "name": "Strúčiky cesnaku",
          "quantity": 2,
          "unit": "ks"
        },
        {
          "name": "Sójová omáčka",
          "quantity": 20,
          "unit": "ml"
        },
        {
          "name": "Rybacia omáčka",
          "quantity": 15,
          "unit": "ml"
        },
        {
          "name": "Limetková šťava",
          "quantity": 20,
          "unit": "ml"
        },
        {
          "name": "Med",
          "quantity": 10,
          "unit": "g"
        },
        {
          "name": "Voda",
          "quantity": 40,
          "unit": "ml"
        },
        {
          "name": "Olej",
          "quantity": 10,
          "unit": "ml"
        }
      ],
      "steps": [
        "Ryžu prepláchnite a uvarte podľa návodu.",
        "Mäso nakrájajte naprieč vláknami; premiešajte s cesnakom a sójovou omáčkou. Mrkvu, papriku a cibuľu nakrájajte.",
        "Na oleji prudko opečte mäso po menších dávkach. Pridajte zeleninu a krátko restujte.",
        "Zmiešajte rybaciu omáčku, limetkovú šťavu, med a vodu. Vmiešajte do mäsa a krátko prehrejte. Rozdeľte s ryžou na dve porcie."
      ],
      "reheating": "Mäso so zeleninou rozmrazte v chladničke a prehrejte na panvici alebo v mikrovlnke aspoň na 74 °C v celom objeme. Ryžu prehrejte samostatne, iba raz a dôkladne až do horúceho stredu. Omáčku pridajte podľa spôsobu podávania. Ohrev nenapraví nesprávne skladovanie ryže.",
      "storage": "Hovädzie mäso s restovanou zeleninou a uvarenú jazmínovú ryžu porciujte a skladujte oddelene. Ryžu rozložte do plytkej nádoby a schlaďte ideálne do 1 hodiny; nenechávajte ju stáť vo vlažnom hrnci. V chladničke pri najviac 5 °C ju uchovávajte najviac 24 hodín pred ohrevom alebo ju po rýchlom schladení včas zmrazte pri približne −18 °C. Mäso a zeleninu rýchlo schlaďte; chladené spotrebujte do 48 hodín alebo zmrazte. Omáčku uložte do samostatnej uzavretej nádoby.",
      "meat": "beef",
      "freezing": true
    },
    {
      "name": "Bravčové Bún chả fašírky",
      "portions": 2,
      "ingredients": [
        {
          "name": "Mleté bravčové",
          "quantity": 500,
          "unit": "g"
        },
        {
          "name": "Ryža",
          "quantity": 150,
          "unit": "g"
        },
        {
          "name": "Mrkva",
          "quantity": 100,
          "unit": "g"
        },
        {
          "name": "Cibuľa",
          "quantity": 50,
          "unit": "g"
        },
        {
          "name": "Strúčiky cesnaku",
          "quantity": 2,
          "unit": "ks"
        },
        {
          "name": "Rybacia omáčka",
          "quantity": 15,
          "unit": "ml"
        },
        {
          "name": "Sójová omáčka",
          "quantity": 10,
          "unit": "ml"
        },
        {
          "name": "Limetková šťava",
          "quantity": 20,
          "unit": "ml"
        },
        {
          "name": "Cukor",
          "quantity": 15,
          "unit": "g"
        },
        {
          "name": "Voda",
          "quantity": 70,
          "unit": "ml"
        },
        {
          "name": "Olej",
          "quantity": 10,
          "unit": "ml"
        }
      ],
      "steps": [
        "Ryžu prepláchnite a uvarte. Mrkvu nastrúhajte.",
        "Mleté mäso premiešajte s nadrobno nasekanou cibuľou a cesnakom, sójovou omáčkou a polovicou rybacej omáčky. Vytvarujte malé fašírky.",
        "Fašírky opečte na oleji z oboch strán a dopečte tak, aby boli úplne tepelne spracované aj v strede.",
        "Vo vode rozpustite cukor, pridajte zvyšnú rybaciu omáčku a limetkovú šťavu. Podávajte s ryžou a mrkvou; omáčku zabaľte oddelene."
      ],
      "reheating": "Hotové fašírky rozmrazte v chladničke a prehrejte v rúre alebo na panvici aspoň na 74 °C v strede každého kusa. Ryžu ohrejte samostatne a iba raz, dôkladne v celom objeme. Mrkvu a omáčku podávajte oddelene. Ohrev nenapraví nesprávne skladovanie ryže.",
      "storage": "Úplne tepelne spracované fašírky, uvarenú ryžu, mrkvu a omáčku zabaľte oddelene. Ryžu rozložte do plytkej nádoby a schlaďte ideálne do 1 hodiny; nenechávajte ju stáť vo vlažnom hrnci. V chladničke pri najviac 5 °C ju uchovávajte najviac 24 hodín pred ohrevom alebo ju po rýchlom schladení včas zmrazte pri približne −18 °C. Fašírky rýchlo schlaďte a chladené spotrebujte do 48 hodín alebo zmrazte. Studenú mrkvu a omáčku uchovávajte v uzavretých nádobách v chladničke.",
      "meat": "pork",
      "freezing": true
    },
    {
      "name": "Sticky chicken teriyaki",
      "portions": 2,
      "ingredients": [
        {
          "name": "Kuracie stehenné rezne",
          "quantity": 500,
          "unit": "g"
        },
        {
          "name": "Ryža",
          "quantity": 150,
          "unit": "g"
        },
        {
          "name": "Mrkva",
          "quantity": 100,
          "unit": "g"
        },
        {
          "name": "Paprika",
          "quantity": 150,
          "unit": "g"
        },
        {
          "name": "Strúčiky cesnaku",
          "quantity": 2,
          "unit": "ks"
        },
        {
          "name": "Zázvor",
          "quantity": 10,
          "unit": "g"
        },
        {
          "name": "Sójová omáčka",
          "quantity": 35,
          "unit": "ml"
        },
        {
          "name": "Med",
          "quantity": 20,
          "unit": "g"
        },
        {
          "name": "Kukuričný škrob",
          "quantity": 8,
          "unit": "g"
        },
        {
          "name": "Voda",
          "quantity": 60,
          "unit": "ml"
        },
        {
          "name": "Olej",
          "quantity": 10,
          "unit": "ml"
        }
      ],
      "steps": [
        "Uvarte ryžu. Kuracie mäso a zeleninu nakrájajte na kúsky.",
        "Mäso orestujte na oleji a tepelne spracujte aj v strede. Pridajte mrkvu a papriku, krátko opečte.",
        "Zmiešajte sójovú omáčku, med, nastrúhaný zázvor, cesnak a polovicu vody. Pridajte k mäsu.",
        "Škrob rozmiešajte vo zvyšnej studenej vode, vlejte do panvice a prevarte do zhustnutia. Rozdeľte s ryžou."
      ],
      "reheating": "Kuraciu zmes rozmrazte v chladničke. Zohrievajte prikrytú na panvici alebo v mikrovlnke, premiešajte a overte aspoň 74 °C aj v strede kúskov mäsa. Ryžu ohrejte samostatne iba raz, dôkladne až do horúceho stredu. Ohrev nenapraví nesprávne skladovanie ryže.",
      "storage": "Úplne uvarené kuracie mäso s teriyaki omáčkou a zeleninou zabaľte oddelene od ryže. Ryžu rozložte do plytkej nádoby a schlaďte ideálne do 1 hodiny; nenechávajte ju stáť vo vlažnom hrnci. V chladničke pri najviac 5 °C ju uchovávajte najviac 24 hodín pred ohrevom alebo ju po rýchlom schladení včas zmrazte pri približne −18 °C. Kuraciu zmes rýchlo schlaďte; v chladničke ju spotrebujte do 48 hodín alebo zmrazte v menších porciách aj s omáčkou.",
      "meat": "chicken",
      "freezing": true
    },
    {
      "name": "Poctivý hovädzí guláš",
      "portions": 2,
      "ingredients": [
        {
          "name": "Hovädzia kližka",
          "quantity": 700,
          "unit": "g"
        },
        {
          "name": "Cibuľa",
          "quantity": 350,
          "unit": "g"
        },
        {
          "name": "Strúčiky cesnaku",
          "quantity": 3,
          "unit": "ks"
        },
        {
          "name": "Paradajkový pretlak",
          "quantity": 25,
          "unit": "g"
        },
        {
          "name": "Sladká paprika",
          "quantity": 18,
          "unit": "g"
        },
        {
          "name": "Celá rasca",
          "quantity": 2,
          "unit": "g"
        },
        {
          "name": "Majorán",
          "quantity": 2,
          "unit": "g"
        },
        {
          "name": "Hovädzí vývar",
          "quantity": 500,
          "unit": "ml"
        },
        {
          "name": "Olej",
          "quantity": 15,
          "unit": "ml"
        },
        {
          "name": "Soľ",
          "quantity": 4,
          "unit": "g"
        },
        {
          "name": "Čierne korenie",
          "quantity": 1,
          "unit": "g"
        },
        {
          "name": "Suché cestoviny",
          "quantity": 160,
          "unit": "g"
        }
      ],
      "steps": [
        "Cibuľu nakrájajte a pomaly opečte na oleji dozlatista.",
        "Pridajte hovädzie kocky a opečte. Vmiešajte pretlak a rascu. Odstavte z prudkého ohňa, pridajte papriku a krátko premiešajte bez spálenia.",
        "Zalejte vývarom, pridajte cesnak, soľ a korenie. Zakryté pomaly duste približne 2–3 hodiny do mäkka; podľa potreby dopĺňajte vodu.",
        "Na konci pridajte majorán a upravte hustotu odparením. Cestoviny uvarte podľa návodu a zabaľte oddelene."
      ],
      "reheating": "Guláš rozmrazte v chladničke a v hrnci za premiešavania dôkladne prehrejte aspoň na 74 °C vrátane stredu kúskov hovädzieho mäsa. Cestoviny zohrievajte samostatne a až potom spojte s omáčkou. Zohrievajte len množstvo určené na konzumáciu.",